title,rating,text,url
This is your first lesson in shared dreaming. Stay calm.,9/10,"Inception is written, produced, and directed by Christopher Nolan. The film stars Leonardo DiCaprio, Ken Watanabe, Joseph Gordon-Levitt, Marion Cotillard, Ellen Page, Tom Hardy, Cillian Murphy, Dileep Rao, Tom Berenger, and Michael Caine. The musical score is by Hans Zimmer and Wally Pfister is the cinematographer. Plot finds DiCaprio playing Dom Cobb, a specialised spy for hire who steals ideas from the dreams of people. But one day he gets a different offer, one that will enable him to see his estranged children. To get his reward he must enact Inception, the planting of an idea in the mind of the selected target. But Inception is thought impossible and should Cobb and his selected team fail? The consequences are unthinkable.There has already been much written and pondered about as regards Inception in the relatively short running time of its life. One can only imagine what will be written and said about it in ten years time. For although it's arguably a bit too early to be talking about it being held in such high regards as the likes of 2001: A Space Odyssey, it's inescapable that Nolan's movie is this current generation's sci-fi classic. That Nolan has managed to make it accessible to the mainstream, and dazzled the eyes as much as the brain in the process, is close to being a piece of genius craftsmanship.Inception is a film that it's better to know nothing about before venturing into it, and then it asks, well Nolan asks, for your undivided attention. It's neither as confusing as some have painted it, nor does it have any tricks-peek behind the curtain type-up its sleeve. The truth is is that Inception has something for everyone; thematically speaking, and that's before we pore over the special effects that sees Nolan raising the bar considerably. As is the case with twisty high concept movies, interpretations are many, with the director rightly abstaining from discourse about his movie. What forms the basis is your basic life and death struggles, with the grey areas during and after given a clever cinematic make over. There's also meditations on grief that this reviewer personally found easy to get involved with; that of course wont work for everyone, but that is just one of many strands that Nolan dangles for the discerning viewer.If that all sounds a bit too serious for the man who has redefined the Super Hero genre, rest assured thrill seekers, Inception is also a loud swirly spectacle. The action is raucous, be it gun fights or zero gravity punch ups, Nolan has not lost the ability to take the viewer on an action fuelled roller-coaster ride, aided superbly by Lee Smith's editing and Pfister's perfectly broad photography While Zimmer's score blends electronic action pulse beats with saddened guitar strains (ex-Smiths guitarist Johnny Marr on 12 string) to craft one of the best scores of 2010. As I said, there's something for everyone here, making it perhaps one of the leading nominees for title of ultimate modern day blockbuster.Then there's the strong ensemble cast, led by a quite scintillating performance from DiCaprio. Following on from his cards played close to his chest turn in Shutter Island, DiCaprio has given 2010 two of its best lead performances. Here he gives real depth of emotion, the kind that makes it easy for the viewers to hang their hats on. His unfussy acting is easy to buy into, giving the character the air of believability, he is the glue that binds the whole film together. Murphy is wonderfully vulnerable, very much an axis in the narrative, while Levitt almost usurps DiCaprio with a neatly layered portrayal that carries a delightful whiff of duality about it. Special praise, too, for Ellen Page. Still in her early 20s, she exudes an intelligent sexiness that shines bright in a role that could have been boorishly played as a cipher in a lesser actress' hands. While Hardy provides brawny levity and Berenger leaves a favourable mark.The Matrix meets Heat and Mission Impossible, only it's written by Phillip K. Dick and Richard Matheson; or something like that. A cracking hybrid movie that's fit to grace any summer and sure to improve and enlighten with further viewings. 9.5/10",https://www.imdb.com/review/rw2410281/?ref_=tturv_perm_28
Totally simple story for an idiot dressed up with special effects and nothing more,No Rating,"I cannot understand why this movie is rated so highly, it is infantile in its storyline and soooo boring. My young teen son was raving about it and forced me to go to it, he was very happy that I was there the 2nd time as I was able to wake him up from the total brainwashing of modern movie making Hollywood style. First of all take a very lousy infantile script and dress it up with all kinds of jargon about dreams and subconscious but in fact the story makes no sense at all and has a crude central storyline that is ridiculous - a teenager could make it up. Next take a good smattering of Hollywood A list actors to make it look slick. Get a fantastic stunt crew and great special effects team to make this silly stupid storyline look amazing and keep a bunch of immature easily duped people in their seats for two hours thinking they are watching ground breaking cinema but in fact are watching a story that does not have any substance and a plot that is fit for a 14 year old. Meanwhile the 14 year old mindset believes in the illusion of the picture and gets 'hooked in' with the violence and the extra wow factor of Hollywood over the top visual blackmail. Once I had exposed this trickery to the 14 year old who by the way woke up and saw it for what it was, meaningless tripe, it was worth the entrance fee just for that. Don't waste your time.",https://www.imdb.com/review/rw2286484/?ref_=tturv_perm_47
"Incredibly made, mind bending and an excellent film to rewatch over and over.",10/10,"To be fair, the movie may be a bit hard to follow without any prior knowledge or for those who struggle with information overloads. However i found it an excellent film that kept me thinking and engaged. Few movies are this engaging as many feel like you- well, are watching a film. With Inception, you feel immersed in the film.It is definitely a very thought provoking film and was very well shot. One of the best movies ever made, if I must say. It is an extremely clever film with an fairly original plot. The entire idea of dreams within dreams is fascinating and exciting as well.",https://www.imdb.com/review/rw7555261/?ref_=tturv_perm_85
A one-of-a-kind mind-blowing masterpiece!,10/10,"My 3rd time watching this movie! Yet, it still stunned my mind, kept me enjoyed its every moment and left me with many thoughts afterward.For someone like me, who've rarely slept without dream, it's so exciting watching how Christopher Nolan had illustrated every single characteristic of dream on the big screen. As it's been done so sophisticatedly, I do believe the rumour that Nolan had spent 10 years to finish the script of Inception. In my opinion, it's been so far the greatest achievement in his brilliant writer-director career. I jumped into this conclusion after making a quick benchmark of Nolan's remarkable works:Memento, as his first signature in the cinema history, is tremendous and has stayed the most mind-bending film I've ever seen. But overall, it doesn't reach the same level of Inception.The Prestige is highly impressive but somehow I haven't been able to find the very particular ""Nolan's spirit"" in it.The Batman Trilogy is the best superhero saga of all time and its peak The Dark Knight is no doubt a masterpiece as well. Nonetheless, every time we talk about it, Heath Ledger takes all the spotlights with his life-time-role: The (unique-and-only) Joker.Then there came Inception where Nolan truly stood out, having every single detail of his work done in the finest way. The multi-layered storyline despite its complexity, remains consistent and originally interesting. From visual aspect, everything was masterly handled: an impeccable cross-cutting allowed the movie to follow Nolan's nonlinear story-telling without being scattered; a wonderful cinematography work completed with incredibly imaginative visual-effects brought into life so many breathtaking scenes, some of them, I believe, will stay in the audience's mind for a long time (city bending in Paris, zero-gravity fight, in limbo, dreams collapsing...). In addition, Nolan had also a solid cast ensemble to help him deliver all of his messages.Later, we had Interstellar. Though I did admire its cinematography and visual-effects, the film itself is nowhere near the level of Inception.SPOILERS AHEAD !!!!! For all who haven't watched this movie, you may stop the reading right here because the following paragraphs contain a ton of spoilers!It is set in the world where there's technology that allows people to literally share dream. There is, in this world, a new kind of corporate spy - ""extractors"" who use this technology to infiltrate the target's subconscious and extract valuable information through a shared dream world. Our hero Mr Cobb (Leonardo DiCaprio), a very well-known extractor, and his partner Arthur (Joseph Gordon-Levitt) are approached by a powerful businessman - Mr Saito (Ken Watanabe) for a nearly impossible mission, something no one has ever done before : instead of stealing, he wants them to plant an idea in a person's subconscious, which is also called ""inception"". In return, Saito offers something that Cobb could never resist: a ticket to go home with his children by taking out the homicide charge against him. So Cobb and Arthur gather a team to carry out the mission: Eames (Tom Hardy) - a veteran identity forger, Yusuf - the only one chemist can make such a powerful sedative for such a complex 3-levels ""dream within a dream"", and Ariadne (Ellen Page) - a newbie but remarkably talented architect whose role is critical for the success of the mission. The target is Robert Fischer (Cillian Murphy) - son and heir of Saito's biggest competitor (Maurice Fischer, who's dying). The goal is to seed an idea into his mind which will make him abandon his father's business, and the team has to carry Saito as visitor in their mission to let him verify the result of inception. While the team go deeper and deeper into Fischer's mind, we discover gradually the dark of Cobb's past, as well as the 2 biggest why concerning our hero: Why he has became such an expert of inception and What is his desperate motivation for taking that insane mission.The movie is not only about the inception mission but more importantly, about the struggle of finding the way in the maze of life. In Cobb's case, it's the maze of dreams built by his memories with his past wife Mal (Marion Cotillard) and his regrets. So as long as he let himself consumed by the past by blaming himself for the death of his love wife, it will keep coming back and haunt his present: the deeper the team go into dream, the more dangerous his subconscious, under the form of his ghostly wife, comes out and could anytime jeopardize the mission. Indeed, if we apprehend the movie with these 2 layers of its story, the ending scene makes perfect sense. Yes! We're now talking about that famous ending which has still remained one of the most controversial movie endings in the cinema history. Did Cobb find Mr Saito in limbo, bring he back to complete the mission then come back to his children in the real world? Or they are still stuck in limbo - the infinite dream world, and the last scene was just his big dream? But all of those question only matter in the first layer of the story: the result of inception mission. When we perceive the story in its deeper layer, as a journey for Cobb to let go of his feeling of guilt for the past and re-find the meaning of his life, this ending did fulfill its job. Cobb didn't even stay to see either if the spinning top would fall because he didn't care any more, what's important to him is that he gonna be with his kids. He did finally get rid of his haunting past and be able to move on, and that matters. And after all, dream or reality, the importance is to truly live. So from this point of view, he has solved the maze of his life.Some short lines about the cast:Leo has done justice to our main character but he did not success to make a leap from his previous similar roles in Shutter Island and Blood Diamond.Joseph Gordon-Levitt could have been more intense, given the fact that he had the most astounding fight scene in the movie (zero-gravity sequence).There was something missing in Ken Watanabe's performance to portray the powerful man who sponsored the crazy mission. Maybe it was his English...Tom Hardy was OK but forgettable because his character didn't have any memorable moment though he had a lot of screen time.Ellen Page was really impressive, she did fully illustrate the cleverness and the keenness of the young brilliant architect. And personally, I did find a lot of charms in her acting.Cillian Murphy has also done a great job. Much more emotionally complex than just a target of the inception mission, his character Robert Fischer, at the end, was not so different than our hero Cobb. They both were struggling to find a way out of their own maze. If for Cobb, it was the painful past with his late wife; for Fischer, it was the grand shadow and the lack of recognition of his late dad.Last but not least, the one who impressed me the most was Marion. Mal was so beautiful and mysterious in a very unique haunting way, mostly with her speaking eyes! And for me, she is the most remarkable character of the movie.",https://www.imdb.com/review/rw4692192/?ref_=tturv_perm_1
Inception: A Smart Movie For Ignorant People,7/10,"I'm afraid I'm a bit confused. I saw ""Inception"" last night. I had high expectations based on miles of positive ink from reviewers and professional critics, all tripping over themselves to bestow demigod status upon Christopher Nolan. These expectations were dashed to bits within the first thirty minutes of the film, and turned to a kind of dread as I realized what folks these days will accept as ""depth"" in their entertainment. I wish I'd never seen those gushing reviews, I would've enjoyed the film much more.Now, don't get me wrong, I'm a fan of Christopher Nolan's Batman reboots ""Batman Begins"" and ""The Dark Knight."" For my money, those were without a doubt the second and third most effective superhero movies to date (sorry, Raimi wins.) The man certainly knows how to keep a story moving along, and he knows how to film action. In the case of The Dark Knight, Heath Ledger provided an emotional lynchpin non-pareil in his Joker portrait, and Nolan milked it for all it was worth. There was real pathos and genuine mortal horror built into the foundation of the film's impressive structure. Also, the fact that it was based on a comic book lowered the bar and allowed the audience to suspend just enough disbelief to allow most of the dorky plot elements to slip through and do their work.Now let's discuss obvious comparisons to an earlier effort in this vein—that is, an action movie dolled up to the nines as philosophical treatise. I'll admit that I was never a fan of The Matrix. I thought it was asinine in conception and brutish in execution, even as I admired some of the visual effects and spectacular stunt work. Comparing The Matrix's ridiculous endless ""stream-of-consciousness"" gibberish about free will with, say, Roy Batty's laconic final soliloquy in Blade Runner, is like comparing the Twilight series' moronic teen romantic angst with David Foster Wallace. Unfortunately, Inception had precisely the same effect on me, which is to say very little.Here we find the great and terrible Nolan exploring the tired territory already plundered in countless films of yore, including Hitchcock's Spellbound and 1980's genre pics such as Brain Storm, The Dead Zone, and Dreamscape. The basic premise reads like a dime store sci-fi novel's back cover: ""In the future, we can enter into each other's dreams! Feel the magic of dreams, within dreams, within dreams! Experience the thrill and wonder of miraculous ""Dream Time."" Oh Boy!"" Within twenty minutes of the film's somewhat intriguing intro, I knew not only how it would end—I also pretty much knew how we were getting there. Nolan plays primarily to the back row, and—no offense, America—but we've been slightly dumbed down over the past few decades, and we're much easier as a whole to entertain than we used to be. Look back at a few films of the past with vast, labyrinthine plot structures like Hawk and Faulkner's ""The Big Sleep"", or practically anything by the Coen Brothers. What's defines their deep-impact gravitas, as opposed to the flat and diffuse emotional landscape of Inception? It's character development, pure and simple. In this case, Nolan didn't have a single character —especially the one played with typically earnest gusto by Leo Dicaprio—with a plausibly human fatal flaw, foible, or reason for doing uh, whatever it was he was doing. We're simply dropped into an alternate universe with rules seemingly invented to favor nerds of any stripe —almost impossibly similar to the one in The Matrix—and told to hold onto our hats, because here we go! Except we're not actually GOING anywhere, or at least not anywhere we haven't been a thousand times before.Sorry to rain on the parade of everyone that's ready to lionize C. Nolan as the great white hope of modern blockbuster cinema, but from my vantage, there is no there there. If you want a lesson in basic existential philosophy, take a class at your local community college. You'll get more out of it, and you can keep your textbook as a souvenir. If it's great car chases you're after, rent ""The French Connection,"" or ""Ronin."" In other words, keep your high-octane action movie out of my high-concept art film. These are two tastes that do not go great together. Meanwhile, if Inception somehow does ""become a religion"" in another five years, than I'm reconsidering my continued faith in Hollywood as some kind of egalitarian oracle, where the huddled masses can go to get their myths, and feel the true power of redemption. If this is the kind of movie that will be worshipped from now on, than the god of blockbuster cinema may truly be dead.",https://www.imdb.com/review/rw2285904/?ref_=tturv_perm_52
"He spent ten years writing his screenplay for ""Inception""",10/10,"It's said that Christopher Nolan spent ten years writing his screenplay for ""Inception."" That must have involved prodigious concentration, like playing blindfold chess while walking a tight-wire. The film's hero tests a young architect by challenging her to create a maze, and Nolan tests us with his own dazzling maze. We have to trust him that he can lead us through, because much of the time we're lost and disoriented. Nolan must have rewritten this story time and again, finding that every change had a ripple effect down through the whole fabric. The story can either be told in a few sentences, or not told at all. Here is a movie immune to spoilers: If you knew how it ended, that would tell you nothing unless you knew how it got there. And telling you how it got there would produce bafflement. The movie is all about process, about fighting our way through enveloping sheets of reality and dream, reality within dreams, dreams without reality. It's a breathtaking juggling act, and Nolan may have considered his ""Memento"" (2000) a warm-up; he apparently started this screenplay while filming that one. It was the story of a man with short-term memory loss, and the story was told backwards.Like the hero of that film, the viewer of ""Inception"" is adrift in time and experience. We can never even be quite sure what the relationship between dream time and real time is. The hero explains that you can never remember the beginning of a dream, and that dreams that seem to cover hours may only last a short time. Yes, but you don't know that when you're dreaming. And what if you're inside another man's dream? How does your dream time synch with his? What do you really know?Cobb (Leonardo DiCaprio) is a corporate raider of the highest order. He infiltrates the minds of other men to steal their ideas. Now he is hired by a powerful billionaire to do the opposite: To introduce an idea into a rival's mind, and do it so well he believes it is his own. This has never been done before; our minds are as alert to foreign ideas as our immune system is to pathogens. The rich man, named Saito (Ken Watanabe), makes him an offer he can't refuse, an offer that would end Cobb's forced exile from home and family.Cobb assembles a team, and here the movie relies on the well-established procedures of all heist movies. We meet the people he will need to work with: Arthur (Joseph Gordon-Levitt), his longtime associate; Eames (Tom Hardy), a master at deception; Yusuf (Dileep Rao), a master chemist. And there is a new recruit, Ariadne (Ellen Page), a brilliant young architect who is a prodigy at creating spaces. Cobb also goes to touch base with his father-in-law Miles (Michael Caine), who knows what he does and how he does it. These days Michael Caine need only appear on a screen and we assume he's wiser than any of the other characters. It's a gift. But wait. Why does Cobb need an architect to create spaces in dreams? He explains to her. Dreams have a shifting architecture, as we all know; where we seem to be has a way of shifting. Cobb's assignment is the ""inception"" (or birth, or wellspring) of a new idea in the mind of another young billionaire, Robert Fischer Jr. (Cillian Murphy), heir to his father's empire. Saito wants him to initiate ideas that will lead to the surrender of his rival's corporation. Cobb needs Ariadne
to create a deceptive maze-space in Fischer's dreams so that (I think) new thoughts can slip in unperceived. Is it a coincidence that Ariadne is named for the woman in Greek mythology who helped Theseus escape from the Minotaur's labyrinth?Cobb tutors Ariadne on the world of dream infiltration, the art of controlling dreams and navigating them. Nolan uses this as a device for tutoring us as well. And also as the occasion for some of the movie's astonishing special effects, which seemed senseless in the trailer but now fit right in. The most impressive to me takes place (or seems to) in Paris, where the city literally rolls back on itself like a roll of linoleum tile.Protecting Fischer are any number of gun-wielding bodyguards, who may be working like the mental equivalent of antibodies; they seem alternatively real and figurative, but whichever they are, they lead to a great many gunfights, chase scenes and explosions, which is the way movies depict conflict these days. So skilled is Nolan that he actually got me involved in one of his chases, when I thought I was relatively immune to scenes that have become so standard. That was because I cared about who was chasing and being chased.If you've seen any advertising at all for the film, you know that its architecture has a way of disregarding gravity. Buildings tilt. Streets coil. Characters float. This is all explained in the narrative. The movie is a perplexing labyrinth without a simple through-line, and is sure to inspire truly endless analysis on the web.Nolan helps us with an emotional thread. The reason Cobb is motivated to risk the dangers of inception is because of grief and guilt involving his wife Mal (Marion Cotillard), and their two children. More I will not (in a way, cannot) say. Cotillard beautifully embodies the wife in an idealized way. Whether we are seeing Cobb's memories or his dreams is difficult to say--even, literally, in the last shot. But she makes Mal function as an emotional magnet, and the love between the two provides an emotional constant in Cobb's world, which is otherwise ceaselessly shifting. ""Inception"" works for the viewer, in a way, like the world itself worked for Leonard, the hero of ""Memento."" We are always in the Now. We have made some notes while getting Here, but we are not quite sure where Here is. Yet matters of life, death and the heart are involved--oh, and those multi-national corporations, of course. And Nolan doesn't pause before using well-crafted scenes from spycraft or espionage, including a clever scheme on board a 747 (even explaining why it must be a 747).The movies often seem to come from the recycling bin these days: Sequels, remakes, franchises. ""Inception"" does a difficult thing. It is wholly original, cut from new cloth, and yet structured with action movie basics so it feels like it makes more sense than (quite possibly) it does. I thought there was a hole in ""Memento:"" How does a man with short-term memory loss remember he has short-term memory loss? Maybe there's a hole in ""Inception"" too, but I can't find it. Christopher Nolan reinvented ""Batman."" This time he isn't reinventing anything. Yet few directors will attempt to recycle ""Inception."" I think when Nolan left the labyrinth, he threw away the map.",https://www.imdb.com/review/rw5287489/?ref_=tturv_perm_102
Nolan never let you down,10/10,One of the best movies out there I highly recommend it,https://www.imdb.com/review/rw4933535/?ref_=tturv_perm_117
The best movie of all time,10/10,"This movie is perfect. Best movie of all time. If you haven't watched it yet, please do.",https://www.imdb.com/review/rw7085054/?ref_=tturv_perm_90
